"Story","Title","Result","Date","Stability","Duration (s)"
"Create Category","Create Category with filled form as registered user","SUCCESS","2022-11-04T21:22:06.7403443+07:00[Asia/Jakarta]","0.0","8.44"
"Create Category","Create Category with empty form as registered user","SUCCESS","2022-11-04T21:22:15.2708912+07:00[Asia/Jakarta]","0.0","1.42"
"Create Category","Create Category with filled form as anon user","SUCCESS","2022-11-04T21:22:16.7000703+07:00[Asia/Jakarta]","0.0","1.37"
"Create Category","Create Category with empty form as anon user","SUCCESS","2022-11-04T21:22:18.0799251+07:00[Asia/Jakarta]","0.0","1.33"
"Get Category","Get All Categories","SUCCESS","2022-11-04T21:22:06.6785093+07:00[Asia/Jakarta]","0.0","8.77"
"Get Category","Get A Category","SUCCESS","2022-11-04T21:22:15.4773399+07:00[Asia/Jakarta]","0.0","3.0"
