"Story","Title","Result","Date","Stability","Duration (s)"
"Get User Information","Get User Information with token","SUCCESS","2022-11-04T20:46:58.1766688+07:00[Asia/Jakarta]","0.0","10.03"
"Get User Information","Get User Information without token","SUCCESS","2022-11-04T20:47:08.4816217+07:00[Asia/Jakarta]","0.0","1.35"
"Login","Login with username and password","SUCCESS","2022-11-04T20:46:58.6115524+07:00[Asia/Jakarta]","0.0","17.63"
"Register","Register with new data","SUCCESS","2022-11-04T20:46:59.0419226+07:00[Asia/Jakarta]","0.0","9.05"
"Register","Register","SUCCESS","2022-11-04T20:47:08.2288053+07:00[Asia/Jakarta]","0.0","6.62"
